{
  "schema": "intyy.faults/1.0",
  "app": "kvfcu",
  "revision": 1,
  "profiles": [
    {
      "id": "server_error",
      "kind": "server_error",
      "at": "@each_request_step",
      "expect_commit": "reconciles_absent",
      "expect_window": "recovers"
    },
    {
      "id": "maintenance",
      "kind": "maintenance",
      "at": "@each_request_step",
      "expect_commit": "reconciles_absent",
      "expect_window": "fails:app_error"
    },
    {
      "id": "known_popup",
      "kind": "known_popup",
      "at": "@each_request_step",
      "expect_commit": "reconciles_absent",
      "expect_window": "recovers"
    },
    {
      "id": "unknown_popup",
      "kind": "unknown_popup",
      "at": "@each_request_step",
      "expect_commit": "reconciles_absent",
      "expect_window": "recovers_or_escalates"
    },
    {
      "id": "session_expire",
      "kind": "session_expire",
      "at": "@each_request_step",
      "expect_commit": "reconciles_absent",
      "expect_window": "recovers"
    },
    {
      "id": "reply_lost",
      "kind": "drop_after_confirm",
      "at": "@commit_point",
      "expect_commit": "reconciles_found"
    }
  ],
  "explained_endings": [
    {
      "styles": [
        "maintenance"
      ],
      "status": "failed",
      "endings": [
        "app_error"
      ]
    },
    {
      "styles": [
        "error_page",
        "blank",
        "unavailable"
      ],
      "status": "failed",
      "endings": [
        "app_error"
      ]
    },
    {
      "styles": [
        "logout"
      ],
      "status": "failed",
      "endings": [
        "app_error",
        "session_lost"
      ]
    },
    {
      "styles": [
        "hang"
      ],
      "status": "failed",
      "endings": [
        "checkpoint_timeout",
        "action_failed"
      ]
    },
    {
      "styles": [
        "*"
      ],
      "min_faults": 3,
      "status": "escalated",
      "endings": [
        "takeover/stuck"
      ]
    },
    {
      "styles": [
        "*"
      ],
      "status": "failed",
      "endings": [
        "outputs_unavailable"
      ],
      "commit": "found_by_check"
    }
  ]
}
